{
  "schema_version": 1,
  "capsule_id": "uos.bootstrap.synthetic-rogue",
  "version": "9.9.9",
  "compatibility": {"architectures": ["arm64"], "board_families": ["synthetic-orion"], "soc_families": ["synthetic-q1"], "partition_models": ["ab"], "transports": ["fastboot"]},
  "payload": {"sha256": "eeeeeeeeeeeeeeeeeeeeeeeeeeeeeeeeeeeeeeeeeeeeeeeeeeeeeeeeeeeeeeee", "bytes": 1024, "install_mode": "bootstrap-capsule"},
  "recovery": {"offline_recovery": true, "log_export": true},
  "security": {"signer": "rogue-signer", "signature": "fixture:rogue-signer:trusted", "expires": "2020-01-01T00:00:00Z"}
}
